{
  "apiVersion": "amaryllis.dev/verify/v1alpha1",
  "kind": "VerificationEvidence",
  "metadata": {
    "id": "verify-android-20260813-001",
    "createdAt": "2026-08-13T08:10:00Z"
  },
  "execution": {
    "status": "completed",
    "startedAt": "2026-08-13T08:08:50Z",
    "endedAt": "2026-08-13T08:10:00Z",
    "durationMs": 70000,
    "repetitions": {
      "requested": 3,
      "completed": 3
    }
  },
  "subject": {
    "application": {
      "id": "com.example.amaryllis-demo",
      "version": "1.4.0",
      "buildId": "10400",
      "digest": {
        "algorithm": "sha256",
        "value": "5ab565d71af467eca99a0a976827b2c4bcf66f3d3b15efe71905b245275cad03"
      }
    },
    "runtime": {
      "package": "@micrantha/react-native-amaryllis",
      "version": "0.1.7",
      "digest": {
        "algorithm": "sha256",
        "value": "928595919ebb66303eb5a96c0ea1984413451f77f9c7c630d8a6c0e8525d4d87"
      }
    },
    "model": {
      "id": "gemma3-1b-it-int4",
      "version": "1",
      "format": "mediapipe-task",
      "digest": {
        "algorithm": "sha256",
        "value": "af3346c46870e663db46a85fd5a0ee9e60d85df6ae0b0bea6e6e61147ad10889"
      }
    }
  },
  "environment": {
    "platform": "android",
    "os": {
      "name": "Android",
      "version": "15",
      "build": "AP3A.240905.015"
    },
    "device": {
      "manufacturer": "Google",
      "model": "Pixel 8",
      "modelCode": "shiba",
      "architecture": "arm64-v8a",
      "memoryClassBytes": 8589934592,
      "capabilities": [
        "physical-device"
      ],
      "correlation": {
        "scope": "run",
        "id": "run-device-1"
      }
    }
  },
  "provenance": {
    "runner": {
      "name": "amaryllis-verify",
      "version": "0.1.0-alpha.1"
    },
    "scenario": {
      "id": "chat-smoke",
      "version": "1.0.0"
    },
    "manifestDigest": {
      "algorithm": "sha256",
      "value": "fbaa3f9cba4b0c2254775bfb221e2ab124ce49422c8b8c730602b0d6326fae5f"
    },
    "collectors": [
      {
        "name": "timing",
        "version": "v1alpha1"
      },
      {
        "name": "process-memory",
        "version": "v1alpha1"
      },
      {
        "name": "lifecycle",
        "version": "v1alpha1"
      }
    ],
    "evaluationSuites": [
      {
        "id": "quality.chatSmoke",
        "version": "1.0.0",
        "digest": {
          "algorithm": "sha256",
          "value": "6e5d639dd3815b6804c2442cc659ef024e5f964c569de001f5ae8bce771ba0f6"
        }
      }
    ]
  },
  "measurements": [
    {
      "name": "timing.initialization.ms",
      "unit": "ms",
      "samples": [
        {
          "iteration": 1,
          "value": 1140
        },
        {
          "iteration": 2,
          "value": 1088
        },
        {
          "iteration": 3,
          "value": 1102
        }
      ],
      "summary": {
        "count": 3,
        "min": 1088,
        "max": 1140,
        "mean": 1110,
        "p50": 1102,
        "p95": 1136
      }
    },
    {
      "name": "timing.ttft.ms",
      "unit": "ms",
      "samples": [
        {
          "iteration": 1,
          "value": 520
        },
        {
          "iteration": 2,
          "value": 505
        },
        {
          "iteration": 3,
          "value": 535
        }
      ],
      "summary": {
        "count": 3,
        "min": 505,
        "max": 535,
        "mean": 520,
        "p50": 520,
        "p95": 533
      }
    },
    {
      "name": "memory.peakRssBytes",
      "unit": "bytes",
      "samples": [
        {
          "iteration": 1,
          "value": 987654321
        },
        {
          "iteration": 2,
          "value": 1001000000
        },
        {
          "iteration": 3,
          "value": 995000000
        }
      ],
      "summary": {
        "count": 3,
        "min": 987654321,
        "max": 1001000000,
        "mean": 994551440.3333334,
        "p50": 995000000,
        "p95": 1000400000
      }
    },
    {
      "name": "storage.modelBytes",
      "unit": "bytes",
      "samples": [
        {
          "iteration": 1,
          "value": 612000000
        }
      ],
      "summary": {
        "count": 1,
        "min": 612000000,
        "max": 612000000,
        "mean": 612000000
      }
    }
  ],
  "checks": [
    {
      "name": "lifecycle.cancelRestart",
      "status": "pass",
      "code": "completed"
    }
  ],
  "evaluations": [
    {
      "name": "quality.chatSmoke",
      "status": "pass",
      "score": 0.91,
      "unit": "ratio",
      "code": "threshold-met"
    }
  ],
  "unavailable": [
    {
      "kind": "metric",
      "name": "thermal.maxState",
      "reason": "unsupported",
      "message": "Collector unavailable on this runner."
    }
  ],
  "errors": [],
  "policy": {
    "profileId": "mobile-chat-reference",
    "requirements": [
      {
        "id": "startup-budget",
        "severity": "required",
        "target": {
          "kind": "metric",
          "name": "timing.initialization.ms"
        },
        "operator": "lte",
        "value": 2000,
        "aggregate": "max",
        "unit": "ms"
      },
      {
        "id": "ttft-budget",
        "severity": "required",
        "target": {
          "kind": "metric",
          "name": "timing.ttft.ms"
        },
        "operator": "lte",
        "value": 750,
        "aggregate": "p95",
        "unit": "ms"
      },
      {
        "id": "memory-budget",
        "severity": "required",
        "target": {
          "kind": "metric",
          "name": "memory.peakRssBytes"
        },
        "operator": "lte",
        "value": 1610612736,
        "aggregate": "max",
        "unit": "bytes"
      },
      {
        "id": "cancel-restart",
        "severity": "required",
        "target": {
          "kind": "check",
          "name": "lifecycle.cancelRestart"
        },
        "operator": "pass"
      },
      {
        "id": "quality-floor",
        "severity": "required",
        "target": {
          "kind": "evaluation",
          "name": "quality.chatSmoke"
        },
        "operator": "gte",
        "value": 0.85,
        "unit": "ratio"
      },
      {
        "id": "thermal-observation",
        "severity": "advisory",
        "target": {
          "kind": "metric",
          "name": "thermal.maxState"
        },
        "operator": "present"
      }
    ]
  },
  "decision": {
    "status": "warn",
    "reasons": [
      {
        "requirementId": "thermal-observation",
        "code": "advisory-evidence-unavailable",
        "message": "Advisory thermal evidence was unavailable."
      }
    ]
  }
}
